{
  "version": "0.1.0",
  "avatarId": "demo-avatar",
  "style": "semi_real_lightweight",
  "parts": {
    "baseBody": "base_body.default",
    "face": "face.soft_01",
    "hair": "hair.short_01",
    "top": "top.basic_01",
    "bottom": "bottom.basic_01",
    "shoes": "shoes.basic_01",
    "accessory": "accessory.none"
  },
  "colors": {
    "skin": "#c98f6f",
    "hair": "#2f2118"
  },
  "faceMorph": {
    "widthScale": 1,
    "heightScale": 1,
    "depth": 0.5,
    "eyeOffsetY": 0,
    "mouthOffsetY": 0
  },
  "faceTexture": {
    "enabled": false,
    "mode": "cutout_overlay"
  },
  "source": {
    "kind": "manual"
  }
}
